{"authority_event_count":263,"authority_head":"event_8680c166445a366e5d794cb5e45c170b","book_id":"book_demo","ced":{"advisory_findings_excluded":3,"definition":"hard consistency errors per chapter in fixed non-overlapping ten-chapter windows","overall_density":0.0,"total_error_count":0,"window_size":10,"windows":[{"chapter_count":10,"density":0.0,"end":"ch_010","error_count":0,"start":"ch_001"},{"chapter_count":10,"density":0.0,"end":"ch_020","error_count":0,"start":"ch_011"},{"chapter_count":10,"density":0.0,"end":"ch_030","error_count":0,"start":"ch_021"}]},"chapter_count":30,"chapters":[{"advisory_finding_count":0,"authority_parent":"event_74249358f43d1c67633824cc5d51a2a0","chapter_hash":"sha256:88aa270de9a61d94441129174bf40cff26193f5cbd9fbce96ae8105283733f48","chapter_id":"ch_001","commit_head":"event_01a16774731b464b68f873f6d2b9aab1","event_count":5,"hard_error_count":0,"run_id":"run_e6c56f17bcd1b5acacb76cda"},{"advisory_finding_count":0,"authority_parent":"event_01a16774731b464b68f873f6d2b9aab1","chapter_hash":"sha256:612d30e8dd86d7d437121943311b5158e2ca88eea007edb089af2b30f3ec3563","chapter_id":"ch_002","commit_head":"event_bf2de0c167c0e96267b2009e8a993243","event_count":5,"hard_error_count":0,"run_id":"run_93bde0acd12b7b2bae3305fb"},{"advisory_finding_count":0,"authority_parent":"event_bf2de0c167c0e96267b2009e8a993243","chapter_hash":"sha256:d54a6e0ab1f3db8ac0bed8f703755f307354fd3a860498eed427a301043d2d26","chapter_id":"ch_003","commit_head":"event_9d1e5311ee1af3bf9a8abd01c679de68","event_count":5,"hard_error_count":0,"run_id":"run_df6e20bdc2ee6c9ef291ffaf"},{"advisory_finding_count":0,"authority_parent":"event_9d1e5311ee1af3bf9a8abd01c679de68","chapter_hash":"sha256:92b3c5f126493f8b1f668abe013a2ee02a7f7045fd158935bd5e04309343c0a3","chapter_id":"ch_004","commit_head":"event_17bc46e2d39e3e63832f85daeaedb434","event_count":5,"hard_error_count":0,"run_id":"run_6edeaaa54f541452bcbc2e78"},{"advisory_finding_count":0,"authority_parent":"event_17bc46e2d39e3e63832f85daeaedb434","chapter_hash":"sha256:cdd6a1d438f78665a973e990d278f97a2e0639d7eaf8231395e03bbb0f219baf","chapter_id":"ch_005","commit_head":"event_107fd4612f857080b7bb245aefa3c111","event_count":5,"hard_error_count":0,"run_id":"run_ddd39e87a82c02c756aefd21"},{"advisory_finding_count":0,"authority_parent":"event_107fd4612f857080b7bb245aefa3c111","chapter_hash":"sha256:9592ea6afeb196209ee6782df5e931dcd3c3fd44da537a49ff299e35346d8416","chapter_id":"ch_006","commit_head":"event_8ba7b8ac99c9d4254991e19ad18f4f72","event_count":5,"hard_error_count":0,"run_id":"run_b0763f1d384e67f1fb943107"},{"advisory_finding_count":0,"authority_parent":"event_8ba7b8ac99c9d4254991e19ad18f4f72","chapter_hash":"sha256:eb1361cb6677f423e318cf22a0cd37683f846500a80bfa2d9c11ae02f3eab736","chapter_id":"ch_007","commit_head":"event_6bc01cd67193968711e1a8d291ded260","event_count":5,"hard_error_count":0,"run_id":"run_8d22191658616d5d4c040297"},{"advisory_finding_count":0,"authority_parent":"event_6bc01cd67193968711e1a8d291ded260","chapter_hash":"sha256:62358b54a75f78c296ef96f218bfa19e48134002b79ecce5a752907bdfc7c547","chapter_id":"ch_008","commit_head":"event_d69b860a2170aedae759f1e476bed0af","event_count":5,"hard_error_count":0,"run_id":"run_6014e910e869436165c1877f"},{"advisory_finding_count":0,"authority_parent":"event_d69b860a2170aedae759f1e476bed0af","chapter_hash":"sha256:e361a3ef14d4f995a7d2bd363e5ca61350611012089293c51bcfdc24acf06e41","chapter_id":"ch_009","commit_head":"event_d0e600ab1f4dd3b26848f334a1b9364e","event_count":5,"hard_error_count":0,"run_id":"run_ef3721ea3bcbe31ff51edbe0"},{"advisory_finding_count":1,"authority_parent":"event_d0e600ab1f4dd3b26848f334a1b9364e","chapter_hash":"sha256:a72ae1c63d325257e3837298ffcb1be6003e3841e565037ca47f34a47aa385d3","chapter_id":"ch_010","commit_head":"event_1344d031d19aa5ed7efefd8c9ca2c7b3","event_count":5,"hard_error_count":0,"run_id":"run_49f142f889ba9e15868c952e"},{"advisory_finding_count":0,"authority_parent":"event_1344d031d19aa5ed7efefd8c9ca2c7b3","chapter_hash":"sha256:456ad7a2542dfbde3783a9b1006fd529648424fcfb68bfa1dcd8a814f13ff7e2","chapter_id":"ch_011","commit_head":"event_1e48a84e8ad6372185546fe061394eda","event_count":5,"hard_error_count":0,"run_id":"run_af4367b61906372e53071a43"},{"advisory_finding_count":0,"authority_parent":"event_1e48a84e8ad6372185546fe061394eda","chapter_hash":"sha256:c4d83229d4d0a6e88b5973166b270d05f4f79649149a6b36c344c4dab7f027b9","chapter_id":"ch_012","commit_head":"event_e85f8ae2020ede504cb90fe1a09eb79c","event_count":5,"hard_error_count":0,"run_id":"run_d9d461db42b3fcfed8b0c720"},{"advisory_finding_count":0,"authority_parent":"event_e85f8ae2020ede504cb90fe1a09eb79c","chapter_hash":"sha256:f61872cccf2ab01e67965258916d53c798d006dd88e2e9bb9f83125dc877991d","chapter_id":"ch_013","commit_head":"event_87f7fb3312c08c4d8fec0961febb65d3","event_count":5,"hard_error_count":0,"run_id":"run_7193dfec1899036714e1975b"},{"advisory_finding_count":0,"authority_parent":"event_87f7fb3312c08c4d8fec0961febb65d3","chapter_hash":"sha256:48cd7efa63197a4a4c1779ae289601ddfed6e4ea6b84cd65611b6322883db160","chapter_id":"ch_014","commit_head":"event_8b7b05af8c0f6eca46356a7c202ee611","event_count":5,"hard_error_count":0,"run_id":"run_bc93a5cb0f4ec4598a45e76b"},{"advisory_finding_count":0,"authority_parent":"event_8b7b05af8c0f6eca46356a7c202ee611","chapter_hash":"sha256:a13fedf5e78c2756c7d3d4c856567bffb661892658e9d1ab781f4df3eaf1a49c","chapter_id":"ch_015","commit_head":"event_d9a37514de79d896cc3f900e6cd6b17a","event_count":5,"hard_error_count":0,"run_id":"run_28c6e5a7db7f3a938f60d235"},{"advisory_finding_count":0,"authority_parent":"event_d9a37514de79d896cc3f900e6cd6b17a","chapter_hash":"sha256:dbbd09f338200cd583d028d64a0995ff08f745732b01d4f8a982812a294f4da2","chapter_id":"ch_016","commit_head":"event_34b0a4837f4a08452546deddcf13acae","event_count":5,"hard_error_count":0,"run_id":"run_35416fa760e3894217bd5c88"},{"advisory_finding_count":0,"authority_parent":"event_34b0a4837f4a08452546deddcf13acae","chapter_hash":"sha256:05b2a35096ab9ca7fd5f2dce5a8597d8ff4aac6fdf59c473e0809b6eaafd6b2f","chapter_id":"ch_017","commit_head":"event_bbe30bc3b67a793da60cfa43fdade125","event_count":5,"hard_error_count":0,"run_id":"run_e6f8d9707bf2e7158da7d046"},{"advisory_finding_count":0,"authority_parent":"event_bbe30bc3b67a793da60cfa43fdade125","chapter_hash":"sha256:91cfd5fb5cb96eb691dbdff407ef06b09de79e521e59f41c61c8c53d54f5b468","chapter_id":"ch_018","commit_head":"event_6775c5e5c2c3a81964e0cf09c1e69c60","event_count":5,"hard_error_count":0,"run_id":"run_86d3e09dc1eb999604ae823b"},{"advisory_finding_count":0,"authority_parent":"event_6775c5e5c2c3a81964e0cf09c1e69c60","chapter_hash":"sha256:746e57a30aba197b67146f5746bba7075174996f107f1e68227df0e00f70b0c9","chapter_id":"ch_019","commit_head":"event_59169d6d1c194c861ec32decc07389dc","event_count":5,"hard_error_count":0,"run_id":"run_cabc4d22d754800e0dd4cc89"},{"advisory_finding_count":1,"authority_parent":"event_59169d6d1c194c861ec32decc07389dc","chapter_hash":"sha256:3b03ca23c5dcdabf31c17e884e87a03a37628ca692bd8cc8d5fac83002d8cdd9","chapter_id":"ch_020","commit_head":"event_df05b71c92a3e69bdae9e2330181b844","event_count":5,"hard_error_count":0,"run_id":"run_4978f64f8ed11a72d3b87191"},{"advisory_finding_count":0,"authority_parent":"event_df05b71c92a3e69bdae9e2330181b844","chapter_hash":"sha256:ceae40e5f0ca3e5fbd7e74b459a1d715acf9fbc83d0bc901ba1a9c2b939283e2","chapter_id":"ch_021","commit_head":"event_09f2f3b2f026f0a162d2f58f63865134","event_count":5,"hard_error_count":0,"run_id":"run_dc0b7cef8a7776cdae754a70"},{"advisory_finding_count":0,"authority_parent":"event_09f2f3b2f026f0a162d2f58f63865134","chapter_hash":"sha256:34b0ad8407861876a608f6372813c45eb8c1b2360f303a88176206b9a3b3053a","chapter_id":"ch_022","commit_head":"event_35e51f29e000de0eb2cdc1ad66cd0d4f","event_count":5,"hard_error_count":0,"run_id":"run_19db9e975d934924f23191a0"},{"advisory_finding_count":0,"authority_parent":"event_35e51f29e000de0eb2cdc1ad66cd0d4f","chapter_hash":"sha256:80da19983f35a670091b789aa35905338d49a22c1c401e981f9acd7f895e9b97","chapter_id":"ch_023","commit_head":"event_3c0758788c17b30b75c2924107be6548","event_count":5,"hard_error_count":0,"run_id":"run_9c9329bde402f9725d37e511"},{"advisory_finding_count":0,"authority_parent":"event_3c0758788c17b30b75c2924107be6548","chapter_hash":"sha256:b7816bda83bc83b0ccaf23ccc170e3ff5ece5e5b8843f85d871ae52852df44a8","chapter_id":"ch_024","commit_head":"event_6c0be5ac8ea6a343332c639b3d5949f1","event_count":5,"hard_error_count":0,"run_id":"run_be251c84c5c4b5acf6417b96"},{"advisory_finding_count":0,"authority_parent":"event_6c0be5ac8ea6a343332c639b3d5949f1","chapter_hash":"sha256:02507911dda2e8fff6b9ab9089cf74acf974b04f4a6c725f4900add604a295c7","chapter_id":"ch_025","commit_head":"event_475a6d938490bdf48e8dd808f7911b7d","event_count":5,"hard_error_count":0,"run_id":"run_aa62d0a3eaff7ca507e6a210"},{"advisory_finding_count":0,"authority_parent":"event_475a6d938490bdf48e8dd808f7911b7d","chapter_hash":"sha256:19f3f51712f7430dcec0b833d0d8e88a8d66634dc8e61f76ef184dab8bd4d378","chapter_id":"ch_026","commit_head":"event_0ffe842095b9f41a72715ab2f6997148","event_count":5,"hard_error_count":0,"run_id":"run_680c9dd2209416fd9cfbee1f"},{"advisory_finding_count":0,"authority_parent":"event_0ffe842095b9f41a72715ab2f6997148","chapter_hash":"sha256:06cb9ecb1e13b57bf34e3cd822938cd38296e059b1d1a96e706a8f19e52419f9","chapter_id":"ch_027","commit_head":"event_cfa93678ef3f1aa81e84bad4a9f39959","event_count":5,"hard_error_count":0,"run_id":"run_b6ccc57b71498d235dbdfd0f"},{"advisory_finding_count":0,"authority_parent":"event_cfa93678ef3f1aa81e84bad4a9f39959","chapter_hash":"sha256:e02893ff6497905f491086515014c4c2ba64d341f64c79cccc6a565bd0024671","chapter_id":"ch_028","commit_head":"event_6ce388ddc0d46a3ec07a9f5027c6ea98","event_count":5,"hard_error_count":0,"run_id":"run_e76775019fc563dcb657c9fa"},{"advisory_finding_count":0,"authority_parent":"event_6ce388ddc0d46a3ec07a9f5027c6ea98","chapter_hash":"sha